review_id,chunk_id,chunk_text,span_start,span_end,asin,category
ELECTRONICS_000000,ELECTRONICS_000000-0,"We got this GPS for my husband who is an (OTR) over the road trucker.  Very Impressed with the shipping time, it arrived a few days earlier than expected...  within a week of use however it started freezing up... could of just been a glitch in that unit.  Worked great when it worked!  Will work great for the normal person as well but does have the ""trucker"" option. (the big truck routes - tells you when a scale is coming up ect...)  Love the bigger screen, the ease of use, the ease of putting addresses into memory.  Nothing really bad to say about the unit with the exception of it freezing which is probably one in a million and that's just my luck.  I contacted the seller and within minutes ",0,700,0528881469,Electronics
ELECTRONICS_000000,ELECTRONICS_000000-1,of my email I received a email back with instructions for an exchange! VERY impressed all the way around!,700,805,0528881469,Electronics
ELECTRONICS_000001,ELECTRONICS_000001-0,"I'm a professional OTR truck driver, and I bought a TND 700 at a truck stop hoping to make my life easier.  Rand McNally, are you listening?First thing I did after charging it was connect it to my laptop and install the software and then attempt to update it.  The software detected a problem with my update and wanted my home address so I could be sent a patch on an SD card.  Hello?  I don't think I'm all that unusual; my home address is a PO box that a friend checks weekly and that I might get to check every six months or so.  I live in my truck and at truck stops.  If you need to make a patch available on an SD card then you should send the SD cards to the truck stops where the devices are ",0,700,0528881469,Electronics
ELECTRONICS_000001,ELECTRONICS_000001-1,"sold.  I ran the update program multiple times until the program said that the TND 700 was completely updated.I programmed in the height (13'6""), the length (53') and the weight (80,000#) of my rig and told it that I preferred highways.  I was parked at a truck stop in the Cincinnati OH area.  My next pickup was about 15 miles down the same freeway but on the other side of it a couple of blocks.  My cell phone GPS (Sprint) said to get on the freeway to get to my pickup.  The TND 700 routed me thru 23 miles of residential streets before finally getting me to my pickup.  Very exciting, especially since every time I refused to turn down a street posted ""No Trucks"" the TND 700 took almost 5 minu",700,1400,0528881469,Electronics
ELECTRONICS_000001,ELECTRONICS_000001-2,"tes to figure a re-route, and it happened multiple times on that short trip.I decided to give it another chance.  After my pickup on the north side of Cincinnati just off of I-75 I needed to head to Phoenix AZ via I-71.  Easy route is to just hop on I-75 and drive west and south to the intersection of I-71.  Indeed, that is what my cell phone advised.  The TND 700, however, wanted to route me over surface streets across the city and pick up I-75 on the other side of the city.  I turned it off and the next time I passed a truck stop of the same chain I purchased it at I returned it and got my money back.I then spent $30 on a cheap printer.  Now I take a minute to set up my route on Google and",1400,2100,0528881469,Electronics
ELECTRONICS_000001,ELECTRONICS_000001-3, print it out.  Hasn't gotten me lost yet over several cross country trips.,2100,2175,0528881469,Electronics
ELECTRONICS_000002,ELECTRONICS_000002-0,"Well, what can I say.  I've had this unit in my truck for about four days now.  Prior to that I had a Garmin 755T non-truck GPS.  One of my favorite features in that unit was the ability to plan a route by determining mileage using the stop or via feature.  What I would do is using a map I would route myself several different ways forcing the unit by putting in stops or vias at different locations along the route, otherwise, like most GPS 's, it determines what it thinks is the best route.  I could add up to 10 Via's or stop points for each route and then based on mileage and other factors determine which is the best route to take.  Multiple stops and the ability to route was the most import",0,700,0528881469,Electronics
ELECTRONICS_000002,ELECTRONICS_000002-1,"ant reason for having the Garmin.  However it was not truck specific.  And considering I am now hauling strictly hazmat I wanted something that would take that into consideration.  After perusing various forums, review sites, and word-of-mouth my choices boiled down to the Garmin 465T or the RAND McNally Intelliroute TND 700.  Even though it was quite a bit more than the Garmin I chose the TND 700 for several reasons.  The main one being the extra screen size, and its ability to coordinate with the RAND McNally truck atlas and also its ease of updating.Now on to my first impression of the TND 700.  It seems to be an aesthetically pleasing and durably built unit.  The first thing I noticed wa",700,1400,0528881469,Electronics
ELECTRONICS_000002,ELECTRONICS_000002-2,"s it's very slow to boot compared to my old Garmin.  Whether this is unique to the TND 700 or is common amongst all truck specific gps units I cannot tell, but it's really not that big of a deal.  The second thing I noticed was the overwhelming wealth of information put forth.  That might explain why the manual (available via the TND dock) is well over 100 pages long.....  There is somewhat of a learning curve with this unit.  The next thing I noticed was the complexity of entering routes.  As previously mentioned I like to force it into my preferred routing by the use of stops or vias.  That was a big no go with this unit.  While you can enter multiple stops or vias it is nowhere near as us",1400,2100,0528881469,Electronics
ELECTRONICS_000002,ELECTRONICS_000002-3,"er-friendly as my old Garmin.  Furthermore there is no way you can determine total mileage on the route that you have chosen, as I could with the Garmin.  Totally flummoxed by what appeared to be an omission of one of the best routing tools a trucker could have I went online and verified through an expert source connected with RAND McNally that no, that feature was a couple updates down the line and was not available at this point.  Unbelievable.  Also forcing the unit to follow a specific route can be very challenging.  For a unit of this price, and feature laden, I find this totally unacceptable.  I am still mulling over selling this unit  and buying the Garmin 465T.  I really do like this",2100,2800,0528881469,Electronics
ELECTRONICS_000002,ELECTRONICS_000002-4," GPS, the screen is magnificent, and the volume is awesome.Another thing I've noticed, which I do not think is unique to this unit, is some of the weird routing that it does.  I've never owned a truck specific GPS before but after playing with this one for a couple of days I get the impression that what RAND MacNally (and the others that use Navteq) has done is take a plain old car specific Navteq map and a road atlas with truck restrictions and made notifications on the map.  In most databases there is not a 100% thorough listing of every road in the country.  What I mean is that this unit will route you down roads you don't belong on.  Today while coming home it tried routing me on several",2800,3500,0528881469,Electronics
ELECTRONICS_000002,ELECTRONICS_000002-5,"  9 ton County roads.  What that means is that a truck is limited to 73280 unless the road is posted at 10 tons.  County roads do not have that restriction listed in the RAND McNally road atlas, so I believe that is why it is not listed.....  Also unacceptable in a unit of this price and sold as truck specific.  However I'd be willing to bet the other truck specific units are the same way as no one has ever done a truck specific version of NavTeq.Another bone I have to pick is the POI's. Not only the truck specific ones but the others all seem to be somewhat outdated.  I think the Garmin, at least the ones that I have used, are more current.  It would also be nice if I could add my own POI's",3500,4200,0528881469,Electronics
ELECTRONICS_000002,ELECTRONICS_000002-6,To sum it up I will keep this unit a little longer to see if I can make it workable.  If not I will go back to Garmin.  I like the concept and I like the unit but at this point I'll have to say I am somewhat unimpressed.pros:Large screenterrific imagesoutstanding volumecons:inability to determine route mileage by multiple stops and viasa somewhat outdated POI information.Non-truck specific routings.Cost.,4200,4607,0528881469,Electronics
ELECTRONICS_000003,ELECTRONICS_000003-0,"Not going to write a long review, even thought this unit deserves one. I've driven well over 1-mil miles and done most of my own routing so I pretty know whats the fastest and shortest. Have been using a basic garmin for the past three years and with ANY Gps unit they'll ALL get you in trouble if you let them. I was really excited about this unit, due to the size and the features. Allot of great grafics and on screen info thats usefull. But the most basic item that it was lacking was the gps tracking. I gave this unit allot of leadway on its mistakes due to the fact that it had allot of cool stuff that it did, but its ability to track you and route you was not even close to what the basic ga",0,700,0528881469,Electronics
ELECTRONICS_000003,ELECTRONICS_000003-1,"rmin could due. Its like the prossesor that they installed in the TND 700 was 10 years old. Example if I needed to make a simple route change I.E. in town down to the next street due to the fact that I couldn't make the turn or the street was blocked off, it would take the TND 700 upwards of 45 seconds to a minute and a half to reroute me. Here I'm sitting at a stop light waiting for directions and waiting that long with cars on my backside didn't make me happy. This is a problem that happened evertime you had to reroute, weather it was a simple street change or a major highway change. Also from the time you turned the unit on it would take twice as long to boot itself up. At least a dozen t",700,1400,0528881469,Electronics
ELECTRONICS_000003,ELECTRONICS_000003-2,"imes with in a week it put me on the wrong roads and when I made a wrong turn it got it self lost....I.E. take left on xyz street, and it was some ones drive way. Or turn left in 800 yards and the turn was less than 10 feet away. You might think in a conjested city situation I might get a little mixed up, but this is out in the country. Twice it put me under 12'6"" bridges when I'm 13'6"". Of course I made sure all my truck setting where they were supposed to be. I also updated the OS version,via Rand McNally. All in all I expected alot out of this unit and got a unit that should of been field tested with some people that drive allot. It just had to many route mistakes. Going back to the basic",1400,2100,0528881469,Electronics
ELECTRONICS_000003,ELECTRONICS_000003-3," garmin. This isn't just my complaints, I have three friends that bought the same unit and have the same complaints. All of us returned the units.",2100,2246,0528881469,Electronics
ELECTRONICS_000004,ELECTRONICS_000004-0,I've had mine for a year and here's what we got. It tries to route be down non truck routes while telling me the truck route is illegal for me. This is such a bad problem that even Interstate 25 in Denver Colorado is listed (according to this GPS) as a non- truck route and will route you through the city instead. There are several drivers within our company who own one and more than half (of about 50) have crashed to an un-recoverable state. Our company representative said that Rand McNally informed them that the GPS was not designed to say on for a long period of time. Really? it's a truck driver GPS. We have one driver with a $2400 dollar ticket due to this GPS routing him down the wrong r,0,700,0528881469,Electronics
ELECTRONICS_000004,ELECTRONICS_000004-1,"oad. The companies response was to update the unit. I've had mine for a year, I never noticed one update that corrected functionality, they only seem to keep messing the tools. I want a GPS that routes, if I wanted tools I'd buy software for my computer.My suggestion is to by a nice Garmen. My one rated for cars actually routes me better than this one rated for trucks.Wayne",700,1076,0528881469,Electronics
ELECTRONICS_000005,ELECTRONICS_000005-0,I am using this with a Nook HD+. It works as described. The HD picture on my Samsung 52&#34; TV is excellent.,0,109,0594451647,Electronics
ELECTRONICS_000006,ELECTRONICS_000006-0,The cable is very wobbly and sometimes disconnects itself.The price is completely unfair and only works with the Nook HD and HD+,0,128,0594451647,Electronics
ELECTRONICS_000007,ELECTRONICS_000007-0,"This adaptor is real easy to setup and use right out of the box. I had not problem with it at all, it is well worth the purchase. I recommend this adaptor very much for viewing your Nook videos on your HDTV. I just disagree with other reviews on the length of the adaptor, I found it to be fairly adequate as to how and where it is connected to my TV. For me it was just right not too long or too short, I was able to place my Nook right below the connection on the TV stand, it did not fall or anything else, it is fine. Use your own judgement, I'm too busy watching my movies :)",0,580,0594451647,Electronics
ELECTRONICS_000008,ELECTRONICS_000008-0,"This adapter easily connects my Nook HD 7&#34; to my HDTV through the HDMI cable.  This is good for traveling because it makes any hotel TV a potential smart TV so long as there is an accessible HDMI port.  It is also good for sharing photos from FB on a bigger screen. A bit pricey, but a good accessory to have.  Be sure to note that this is ONLY for the Nook HD and HD+ series.  It will not work with a standard Nook.",0,420,0594451647,Electronics
ELECTRONICS_000009,ELECTRONICS_000009-0,This product really works great but I found the following items you need to keep in mind:- You must have your power adapter connected for it to work...it plugs in the the bottom. It appears it needs power from the nook power adapter to operate.- The plug fits in loosely and you cannot move the Nook around much without holding the adapter in place.- On initial plugin it seems you need to rock it around to get the connection but then it seems solid.- It works with a 25ft high quality HDMI cable so you can put the NOOK across the room with you. Not tested with cheap cables.Warning...I found that my LG SmartTV 3D from a few years back does not work with this adapter but it does not seem to work ,0,700,0594451647,Electronics
ELECTRONICS_000009,ELECTRONICS_000009-1,with many things...bad software. This adapter works fine with other HDMI devices I have used like monitors and I am sure other TVs.Gave it five stars because it really is nice to extend the screen and use your Nook as a streaming server to your TV. Nice they made such a device.,700,978,0594451647,Electronics
ELECTRONICS_000010,ELECTRONICS_000010-0,"This item is just as was described in the original description, works without any issues to be seen. Good product",0,113,0594481813,Electronics
ELECTRONICS_000011,ELECTRONICS_000011-0,bought for a spare for my 9&#34; Nook HD and it fit perfectly.  Very satisfied with the price much less than on the BN site,0,123,0594481813,Electronics
ELECTRONICS_000012,ELECTRONICS_000012-0,"My son crewed my HD charger cord so I needed another one, this is exactly like the one my son destroyed.",0,104,0594481813,Electronics
ELECTRONICS_000013,ELECTRONICS_000013-0,"This is a good beefy 2 amp charger, but it covers two outlets on a power strip. It's ok in a regular wall outlet. The best thing is it uses a standard USB connector so it can charge more than just a Nook (I have a Kindle Fire HD+).",0,231,0594481813,Electronics
ELECTRONICS_000014,ELECTRONICS_000014-0,"I lost my B&N original cable.  I looked around for an new one.  I tried  a different, cheaper model but it didn't fit my device properly so back to the drawing board.  I ordered this one.  I am satisfied.  It works exactly as expected and fits perfectly.  I would recommend this product to anyone looking for a spare or in lieu of the original usb cable adapter.",0,362,0594481813,Electronics
ELECTRONICS_000015,ELECTRONICS_000015-0,"It does 2A and charges a DEAD Nook in a few hours. It does so with a LOT of heat, compared to most wall worts. I have a dual charger where 1 port is 2.1A and the other is 1A for total output of 3.1A that doesn't run as hot as this. And i use that to power a raspberry pi to avoid needing a powered hubIt does the job adequately as it's designed to. Just hot. I would always unplug it if not using (even though it cools off) because of the amount of heat made. The nook hd+ runs hot too right where you hold it on the left side in portrait, but not so much when charging. I guess it's better to have it at the plug.",0,614,0594481813,Electronics
ELECTRONICS_000016,ELECTRONICS_000016-0,"Go to Target or Barnes and Noble instead, and pay $25 (which is still a huge markup, considering they make the thing for 50 cents.) This is the worst option if you need one of these. It's price gouging, pure and simple.",0,219,0594481813,Electronics
ELECTRONICS_000017,ELECTRONICS_000017-0,"Works well, a little pricey I think for a charging cable, but then again, not losing the original would be a lot cheaper than any replacement",0,141,0594481813,Electronics
ELECTRONICS_000018,ELECTRONICS_000018-0,"This is a great buy, compared to a $60 or more a retail store.",0,62,0972683275,Electronics
ELECTRONICS_000019,ELECTRONICS_000019-0,This mount is just what I needed.  It is strong and sturdy.  It folds almost flat to enable the television to sit square and flat against the wall if desired and extends and rotates for angle turns.  A perfect fit as long as you match the correct visa pattern for your television.,0,280,0972683275,Electronics
ELECTRONICS_000020,ELECTRONICS_000020-0,"Great deal, easy to mount and it appears to be fairly sturdy. I mounted a 32 in tv on it and it works great.",0,108,0972683275,Electronics
ELECTRONICS_000021,ELECTRONICS_000021-0,This mount works really well once you get it up and going.  Only problem is just the arms are a little goofy getting them all in the right spot.  But that's really not too big an issue considering all the different TV's and their mounting hole locations.,0,254,0972683275,Electronics
ELECTRONICS_000022,ELECTRONICS_000022-0,"This wall mount does everything it's supposed to do.  The piece that attaches to the wall isn't overly long, which made it easier to mount the arm in the tight space I needed to mount it in.  The only issues I saw was that the joints were VERY tight initially and as we moved the arm around to install it, the joints loosened up to the point where I had to take the included allen wrench and tighten them up again.",0,414,0972683275,Electronics
ELECTRONICS_000023,ELECTRONICS_000023-0,for the price you just cant beat this item. I bought it for a house I was selling so I could hang some tv and it worked great. Good quality for the price.,0,154,0972683275,Electronics
ELECTRONICS_000024,ELECTRONICS_000024-0,"I received the mount, which was well packaged for shipping.  The installation instructions were Moderately clear.  No issues following them, they were just a little disjointed depending on the wall surface you were installing on.My shipment had a mis-cut piece, and was missing 4 screws.  I contacted the Manufacturer, and they shipped me a replacement part and screws the very next day (Shipped out of Texas, so normal mailing times applied)I like how the Mount fits together, and I easily mounted my 60lbs TV by myself.  The part that attaches to the TV has a hook that will hold the TV on the Arm till you bolt it on.It's very adjustable, and pushes almost flush with the wall.I'm very happy, but ",0,700,0972683275,Electronics
ELECTRONICS_000024,ELECTRONICS_000024-1,took one star for the miscut piece.,700,735,0972683275,Electronics
ELECTRONICS_000025,ELECTRONICS_000025-0,"Took a bit of work, but used this to fit an older vizio 32&#34; monitor to the wall to use as a compute monitor. Stable and like the ability to move the tv to different angles. The vizio was older and did not have the standard holes, this product fit and holds the tv very stable.",0,280,0972683275,Electronics
ELECTRONICS_000026,ELECTRONICS_000026-0,I used this for my 47&#34; Samsung. Its fit/feel is great. Easy installation. Appears strong; although I personally spent way too much on the tv to risk leaving it fully outstretched with too little lag bolts for a long time! It is very convenient to be able to move it away from the wall however and I would feel very comfortable tilt or swiveling if needed. The movement is fluid and easily adjustable.I am very pleased with my purchase.,0,439,0972683275,Electronics
ELECTRONICS_000027,ELECTRONICS_000027-0,"This item serves its purpose as well as any other mount.  Its most appealing attribute is its large range of motion.  I am using this to corner-mount a 32"" TV and it works perfectly to hide the mount, receptacles, and cables behind the TV.  Very easy installation as well.",0,272,0972683275,Electronics
ELECTRONICS_000028,ELECTRONICS_000028-0,I love this mount.  This is the 4th one I've bought and it works great every time.  excellent seller and excellent product,0,122,0972683275,Electronics
ELECTRONICS_000029,ELECTRONICS_000029-0,I am very glad for buying it.  It is heavy duty and good quality for the price.  It was very easy to install.,0,109,0972683275,Electronics
ELECTRONICS_000030,ELECTRONICS_000030-0,this holds up my 55inch sony with ease. make sure u mount this with ur own lag screws into the heart of the 2x4 ur mounting to and u won't have any problem--u may have to make a modificatoin or two but use ur brain and figure it out-- it'll be there till the house falls!!!3inch lag screws is the way to go don't be cheap go buy em.---how much did u pay for the tv????,0,368,0972683275,Electronics
ELECTRONICS_000031,ELECTRONICS_000031-0,Nice quality still works great... very happy with this purchase... need to add 10 more words.. so what can I say its a wall mount that I haven't had any problems with,0,166,0972683275,Electronics
ELECTRONICS_000032,ELECTRONICS_000032-0,"Great bracket for small TVs.  I used it on a 19"" LCD and it worked well.  The large mounting plate may block some connections on some TVs.  Installed easily and could be adjusted to make level.  The links were very tight and need to be loosened for initial installation.  When the TV is in the desired position, you can tighten them up.",0,336,0972683275,Electronics
ELECTRONICS_000033,ELECTRONICS_000033-0,"I bought this for a 22"" TV for my son. I mounted this onto the corner stud and it works great! I love the angles it can achieve. Fees Very sturdy and well built. It works perfect for my application. Very happy with this purchase!",0,229,0972683275,Electronics
ELECTRONICS_000034,ELECTRONICS_000034-0,"I am using this mount for a 39 inch Vizio TV and it has been great. The installation process was quick and easy and we LOVE the variety of angles that you can get from this mount. We have it on a side wall in our bedroom and we can pull the tv out and move it completely perpendicular to the wall on which it is mounted if we want to. (We don't usually move it quite perpendicular, but it works to do this.)My only complaint is that the joints are a little on the stiff side. It takes quite a bit of force to move the TV from one position to another. It's a little hard for my wife to do-- especially with the TV mounted about 6ft up on the wall. It may be possible to loosen these pivot points, but ",0,700,0972683275,Electronics
ELECTRONICS_000034,ELECTRONICS_000034-1,"I have not tried. I'm a little nervous about making it less stable if I do.Overall, it's a great mount. Highly recommended.",700,823,0972683275,Electronics
ELECTRONICS_000035,ELECTRONICS_000035-0,"I installed this for my sister who had a 22"" Philips LCD. Nice sturdy mount, with all of the nuts, bolts, screws included. Only problem was that since my tv was so small, and I was using the most inner mounting hols on the mount, the outside edges of the mount covered both the cable connection, and the power cable connection. Instead of returning, (then paying $70 from a local store) I simply went to a hardware store, got a 1 & 1/2 inch boring tool that attaches to a hand drill, and drilled holes into the mount. It was pretty easy, but a bit messy. It is not visible after mounting the TV, so who cares?? It is one thing to consider before buying this, there may be another mount that does not ",0,700,0972683275,Electronics
ELECTRONICS_000035,ELECTRONICS_000035-1,"cover your TV connections. Otherwise swivels well, does not sag, good value.",700,776,0972683275,Electronics
ELECTRONICS_000036,ELECTRONICS_000036-0,"Didn't think it would work as well as it has,because the metal was a lighter guage thanwe expected, but it hardly deflected from theweight of the TV, even extended straight out.",0,177,0972683275,Electronics
ELECTRONICS_000037,ELECTRONICS_000037-0,"very heavy duty construction, extends, tilts perfectlya steal at this pricewill be happy to buy another 1 or 2 if needed",0,120,0972683275,Electronics
ELECTRONICS_000038,ELECTRONICS_000038-0,Well constructed wall mount for TV sets up to 37 inches. The mounting  plate has numerous holes for varius sets. Plenty of extra hardware provided. Price was about 1/8th of what it would cost on the open market. I recommend it highly.,0,234,0972683275,Electronics
