review_id,chunk_id,chunk_text,span_start,span_end,asin,category
ELECTRONICS_000039,ELECTRONICS_000039-0,"I used it to mount a 32"" LCD TV to the wall... about 28LBS.  I installed it in less than 1/2 hour and am very happy with the results.PROS:-Comes with all of the hardware you'll need-Comes with some extra hardware of which I have NO IDEA what it is there for.  I suspect it's a 'universal' hardware pack for several models and not all hardware is used for all models, but it's nice to have a little 'extra' (which is always better than not enough!)-The included Level is nice... well it's cheap but it works!-The instructions did a decent enough job of explaining how to install the unit.CONS:-Metal is just a tad on the flimsy side.  I have no problems trusting it with my &lt;30lb television but if ",0,700,0972683275,Electronics
ELECTRONICS_000039,ELECTRONICS_000039-1,"I were to mount something closer to its maximum rated weight of 55lbs, I think I would be quite a bit nervous about it holding up.-The holes in the base were just a little bit too wide for my wall stud.  I think the particular stud I was installing it onto was a typical 2X4 and if centered, the left and right side holes were just a little too far to grab both sides of the stud.  I had to reposition it so that the center holes were aligned to the left side of the stud, and that the right side holes were aligned to the right side of the stud.  As a result, I was only able to install four of the six bolts to hold it in place, but I don't feel it will be an issue with my 28LB television.  If you",700,1400,0972683275,Electronics
ELECTRONICS_000039,ELECTRONICS_000039-2,"r house uses wider studs this probably wouldn't even be an issue.-The metal does sag just a little bit with the weight of the television on it.  I mounted the base just a little bit ""off level"" to help compensate for this, and had no problems getting the television level using the adjustments available to me.CONCLUSION:  All in all It's not a bad unit.. ESPECIALLY for the price.  Yes I would have liked to see a sturdier unit, but when you take into account the &lt;$30 price tag, it's an excellent bargain.  I don't think I'll have any issue with a static mounting of my TV in the corner of the bedroom *BUT* if you are considering installing this unit for a television that will see a lot of tra",1400,2100,0972683275,Electronics
ELECTRONICS_000039,ELECTRONICS_000039-3,"ffic, constant repositioning, etc... then you might want to spend more money on something sturdier.",2100,2199,0972683275,Electronics
ELECTRONICS_000040,ELECTRONICS_000040-0,"This mount is excellent. It is very well built and sturdy. I used it to mount a 32"" TV and it fit the need perfectly. The price was also very good and much, much cheaper than what an inferior mount would cost in a retail store. I would definitely recommend.",0,257,0972683275,Electronics
ELECTRONICS_000041,ELECTRONICS_000041-0,Works great and is so much cheaper than the more expensive versions at the Big box stores. It is super easy to install yourself too. You just need a drill and a ratchet set to get it into the stud (oh yea a stud finder too).,0,224,0972683275,Electronics
ELECTRONICS_000042,ELECTRONICS_000042-0,"We bought this for the tv in our gym as it gets moved around a bit.  It's definitely sturdy and works well.  Our tv in there is 24&#34;,",0,136,0972683275,Electronics
ELECTRONICS_000043,ELECTRONICS_000043-0,"For the price, you can't beat it. Mine didn't come with any of the screws for the TV, but luckily I had some leftover from another mount so I didn't want to bother returning it. Also, not sure what they mean by tilt, but mine doesn't. The arm extends in and out as said, tv swivels left to right, but does not tilt up and down as was my expectation. Otherwise, can't beat it for the price as in Target/Best Buy etc., these are going for $60+.",0,442,0972683275,Electronics
ELECTRONICS_000044,ELECTRONICS_000044-0,"Cannot beat this deal anywhere else on the web!  All other retailers are over-priced for what you are getting - a couple pieces of fabricated metal to hold a TV that articulates! This mount is reasonably priced.Pros:  Easy to install (helps to have a cordless driver to drill 6 pilot holes, and to drive in 6 lag screws. You also need to have a stud finder).- Well fabricated- Mount does everything advertised (i.e. articulates - you made need to loosen up some nuts)Con's: Really stretching here since this is a good deal: Instructions could use some help for the ""novice"" DIY'ersInstall tip:  It really helps if you have a second person assisting you for the final step of mounting the flat panel t",0,700,0972683275,Electronics
ELECTRONICS_000044,ELECTRONICS_000044-1,"o the TV mountInstalled a 15.5 lbs, 26 Inch Flat Panel LCD (VESA 200mm X 100mm) to this mount. Mount works beautifully! I originally had the TV sitting a little high on a stand, but then the picture was not as good because of the upward viewing angle of the screen (inherent problem with cheaper LCD's - not being directly in front of a LCD screen) - this mount corrected this issue by allowing me to ""tilt down"" the screen.  I would strongly recommend this mount if you are in the market.",700,1189,0972683275,Electronics
ELECTRONICS_000045,ELECTRONICS_000045-0,This mount is easy to install and very sturdy and is very functional and very affordable for the price. A+,0,106,0972683275,Electronics
ELECTRONICS_000046,ELECTRONICS_000046-0,"Works like a charm! Lies flat on the wall when I want it too and pulls out and swivels like a charm when I need it too!The instructions call for it to be mounted into a stud in the wall, however mine is mounted directly into the drywall using heavy duty anchors and it works perfect as well! This is a great product for an amazing price!",0,337,0972683275,Electronics
ELECTRONICS_000047,ELECTRONICS_000047-0,"Easey to put together and install. Used to mount a 37"" LED flat screen. Instuction say to mount the complete unit but if you mount the TV to the back plate on the ground first its a one person job. Well built product for being made in China.wish you could buy American made, better luck next time.",0,297,0972683275,Electronics
ELECTRONICS_000048,ELECTRONICS_000048-0,I hung this in my house with great ease and it held up my 8 year old son because I wasn't going to put the 55&#34; flat screen on it to find out that it failed. Fully extends out 2 feet. This was worth the money.,0,212,0972683275,Electronics
ELECTRONICS_000049,ELECTRONICS_000049-0,"Wanted the monitor off of the desk, so we mounted on the wall.  I would have rather had a vertical adjustment as well, but for the price, this unit does the job.",0,161,0972683275,Electronics
ELECTRONICS_000050,ELECTRONICS_000050-0,"very secure, we did have to use concrete bolts thought since we were putting it on an outside wall made of lath and plaster with concrete brick on the outside.  One of the best features is there is one piece that attaches to the tv and another that attaches to the wall.  the piece on the tv actually hooks onto the piece on the wall.  I am really happy with this purchase.",0,373,0972683275,Electronics
ELECTRONICS_000051,ELECTRONICS_000051-0,"I live in a studio condo and I needed something to rotate to see from my bed and my couch on the other side of the main room. Once you figure out which instructions to use (several varieties are included to accommodate different scenarios and tvs), they are pretty thorough. Don't be afraid to tighten specific &#34;joints&#34; and loosen others to get it how you want it.Originally had bought a different one, and be careful of this, but it didn't didn't have near the amount of swing as this one does.",0,503,0972683275,Electronics
ELECTRONICS_000052,ELECTRONICS_000052-0,Holds the TV fine and the articulation is great.  We use it in a downstairs bedroom where we can move it to be seen from the bed or the treadmill.  Has cable mgmt as well.,0,171,0972683275,Electronics
ELECTRONICS_000053,ELECTRONICS_000053-0,Another great buy from Amazon. The local stores wanted twice the money and the other mounts were cheaply made. this mount is made well and you get a free hdmi cable and level with it,0,182,0972683275,Electronics
ELECTRONICS_000054,ELECTRONICS_000054-0,Just to know that the TV will sit off center of where the base is placed. Other than that it has held up and worked.,0,116,0972683275,Electronics
ELECTRONICS_000055,ELECTRONICS_000055-0,"This is the best mount I have ever found, especially for the price.Home Depot has a nearly identical mount for $90.This mount comes with every fastener you could need from Lags, Hollow Wall Anchors, Spacers, to varying lengths of Metric Fasteners to most if not all TVs.They mount easy and are sturdy; I have a 60&#34; LED TV on one without issue.I also have 32&#34;, 42&#34;, 46&#34;, and 50&#34; TVs on them; I have used these to mount every LED/LCD TV I or friends have mounted.",0,481,0972683275,Electronics
ELECTRONICS_000056,ELECTRONICS_000056-0,"Quality was excellent. Instructions were clear. It was not clear about a tilt feature, but there was enough to level it when I finished. Be careful to get the wall bracket real vertical. (I was using it for a 23 inch computer screen so I really need it to be level for reading.) Everything I needed plus lots of extra hardware for different situations.",0,352,0972683275,Electronics
ELECTRONICS_000057,ELECTRONICS_000057-0,"In the process of turning our master bedroom into a fortress of solitude for my wife, we decided to mount ourPanasonic TC-L32X2 32-Inch 720p LCD HDTVon the wall, above the dresser, to save some space. (You can never have enough dresser space for displaying tchotchkes, amirite, fellas?) My wife wanted a fixed wall mount but I thought the viewing angle required some articulation. (In hindsight, fixed would have worked, too.) This unit was highly rated and the price was right. Sold.The installation was straightforward and fairly simple. The only point at which I needed some help was in balancing the TV while I attached it to the arm; otherwise it was all me. I think it looks great; my wife says",0,700,0972683275,Electronics
ELECTRONICS_000057,ELECTRONICS_000057-1," it reminds her of being in the hospital. (Sorry, Honey.) When we mount thePanasonic VIERA TC-P42S30 42-Inch 1080p Plasma HDTVin the living room, I'll definitely use a flat mount.You could spend four times this much on an articulating TV mount, but I don't see why you would.",700,975,0972683275,Electronics
ELECTRONICS_000058,ELECTRONICS_000058-0,"I gave this mount 3 stars.5 to start because out of the box, and mounted on the wall, I really liked it for my daughter's room. The ability to move her 26"" TV around so she can play in other areas of the room is a welcomed addition.I subtracted 1 star because of the tacky instructions and poor cable management for something that moves at maximum, about 2 feet away from the wall.1 more star fell off because now that the TV is mounted, the mount seems to sag, even though there are two huge lag bolts in a stud mounting it. That parts not the problem, the problem is where the tv mounts to the plate itself, it seems no matter how many washers you use, it just does not make full contact. Also if y",0,700,0972683275,Electronics
ELECTRONICS_000058,ELECTRONICS_000058-1,"ou move the TV to a new position the mounts seems to want to ""fall"" in that direction on its hinges. SO it must be releveled by yanking on it every time it moves.Otherwise, it works I guess. But for $50 I'd rather have a stationary mount that I never have to worry about. I would not set a tv larger than a 30"" or so on this. I just don't trust it.",700,1048,0972683275,Electronics
ELECTRONICS_000059,ELECTRONICS_000059-0,"For the price, this wall mount is great.  Not too hard to install.  The only reason I didn't give it a 5 star is wire management.  I could not get the little loop to work.  Not a big deal at all however.  Overall, I highly recommend this product.  Well worth the money.",0,269,0972683275,Electronics
ELECTRONICS_000060,ELECTRONICS_000060-0,"Needed a corner mounted Flatscreen. This did the job well, easy to install. I had to mount in a metal stud, so I used two support boards in the back to distribute the weight more evenly. Expectations of item met at a fraction of the cost from competitors.",0,255,0972683275,Electronics
ELECTRONICS_000061,ELECTRONICS_000061-0,"I'd never bought one of these, mainly due to the high prices in the retail stores.  I hadn't looked online much, and hadn't really needed a monitor mounting device until recently.This thing is well built, and it does the job.  It's not fancy but if you are just looking for an inexpensive way to hang a monitor (TV or PC) on the wall this will do the job.  It comes with a nice bag of heavy-duty hardware.  It is primarily designed for mounting TV sets, but you can get it to work with a PC monitor, as long as it has the VESA mounting.It mainly articulates side-to-side and in-and-out.  It'll pivot a bit up and down, but that's limited.",0,638,0972683275,Electronics
ELECTRONICS_000062,ELECTRONICS_000062-0,"Only gave this four stars because it's only supporting a 32&#34; TV. I think I would be scared to mount a 55&#34; TV on it. If you sprang for a 50&#34; or bigger TV, spend a little more on a properly rated mount. As with any TV mount, make sure you're hitting wall studs with the main screws, don't just use anchors in drywall or you're asking for trouble. LOTS of hardware included in the kit, so mounting any style or brand of TV shouldn't be a problem.",0,455,0972683275,Electronics
ELECTRONICS_000063,ELECTRONICS_000063-0,"Nothing fancy, just decent quality and simple installation.  As may have been mentioned, one must discard the provided Phillips screws that the manufacturer provides to affix the bracket to the wall stud.  Use your own.  The TV I mounted with it is an older flat-panel, so it's a little heavier than the news ones.  This thing isn't fazed, and stays where I put it.",0,365,0972683275,Electronics
ELECTRONICS_000064,ELECTRONICS_000064-0,Amazing how easy it is to move my 46&#34; around on this mount and able to hang off one stud. Nice quality feel to metal it is made of.,0,135,0972683275,Electronics
ELECTRONICS_000065,ELECTRONICS_000065-0,"Very sturdy. The arm is very stiff at first so you have to work it lose.  However, the mount works great, just make sure you get that stud just right. I was impressed with the quality and happy with the price.",0,209,0972683275,Electronics
ELECTRONICS_000066,ELECTRONICS_000066-0,"Don't have anything to really complain about.  EXCEPT there doesn't seem to be a way, or i'm missing it to tilt the TV up or down (ie. mounted high on the wall and pointed down towards the chair).  and i am quite savvy with tools/assembly/etc. And it is difficult to get to the bolt heads on the back of the TV to adjust the angle.  No reason to not buy it though.",0,364,0972683275,Electronics
ELECTRONICS_000067,ELECTRONICS_000067-0,"Bought the mount for my 30&#34; Dell U3011 monitor.  It fits the Dell quite well, and I bought it for it's reach from the wall, it's ability to manipulate, and it's weight capacity.  And in all those respects, I'm quite happy.However, there is a noticeable tilt/sag to the monitor when I have the arm extended.  I'm not so concerned with sag perpendicular to the wall, as that was expected, but the rotational sag that I sometimes get.",0,435,0972683275,Electronics
ELECTRONICS_000068,ELECTRONICS_000068-0,"The mount plate and the extender arms need to be screwed together and there are two holes for each arm to attach to the corner of the plate. The holes don't align so I couldn't put two screws in. I just used one screw which is not the most secure attachment. Then I used zip ties to secure the arm better. I did this because I had to install the tv ASAP and could not wait for a replacement. Also, the mounting bracket that attaches to the wall has a larger screw hole on the bottom. This means that the bottom can wiggle and the bracket will be misaligned. Again, I did a quick fix. I gave this 2 stars and not 1 because it actually stayed up on the wall and is now holding my tv, albeit due to my o",0,700,0972683275,Electronics
ELECTRONICS_000068,ELECTRONICS_000068-1,wn ingenuity and not the quality of the mount. I should not have to do quick fixes on a product like this.,700,806,0972683275,Electronics
ELECTRONICS_000069,ELECTRONICS_000069-0,"VERY HAPPY, it looks great, I'm so happy we got it. Holds good, it is a lil hard to get it to the wall. Other then that its fine I love how we have more room in our room. My husband is so happy I ordered this, it only cost us $28 free shipping and FAST(: VERY THANKFUL TO THE SELLER.",0,283,0972683275,Electronics
ELECTRONICS_000070,ELECTRONICS_000070-0,"I wasn't willing to pay $100 for simply mounting a TV, so I bought this item to give it a shot. I have no real complaints.  It holds the TV up, which is all I wanted.  It does not have smooth pivot points, so if you're planning on moving it around a lot, don't use this one, but if it's going to stay in a static area, this is your mount.",0,338,0972683275,Electronics
ELECTRONICS_000071,ELECTRONICS_000071-0,"Bought NEW but I could tell right away that mine had been repackaged and refurbished.  Plus the was missing the 4 arms but had some other random hardware included.  I made mine work for my 32&#34; set and it serves it's purpose. Just wish the seller was upfront on the condition, I could have bought a used one for $5 less.",0,323,0972683275,Electronics
ELECTRONICS_000072,ELECTRONICS_000072-0,This is a rather good tv mount. This tv mount works exactly as expected and described. I would buy again.,0,105,0972683275,Electronics
ELECTRONICS_000073,ELECTRONICS_000073-0,"I had to use a hacksaw to cut away part of this to hang my 24&#34; LED TV in my bedroom. Other than that, seems to work fine.",0,125,0972683275,Electronics
ELECTRONICS_000074,ELECTRONICS_000074-0,"I have a 42&#34; Hannspree LCD TV. It weighs 42.5 lbs. Most other reviews said they had a TV smaller than this so I was a little skeptical but got it because of the good price and it said it could hold 60 or so lbs. Most of my reservation was because it was the first time I've mounted a TV and worried it would fall within a week. I've had it over a month and its nice to have it be able to swing out, extend, and angle. I like the fact that I can get a bigger TV and still use this mount as its in my living room. It was not too hard to install. I bought a stud finder because I didn't have one and most everything else I already had to install it. I do highly recommend recruiting some help with t",0,700,0972683275,Electronics
ELECTRONICS_000074,ELECTRONICS_000074-1,"he install, at least for when putting the TV on. This would be extremely hard by yourself, especially if you have a bigger TV. Overall, very happy with this mount.",700,863,0972683275,Electronics
ELECTRONICS_000075,ELECTRONICS_000075-0,Installed easy and in no time at all (finding the stud was the hardest part for me).  Articulates well with the 40&#34; TV on it. I would not hesitate to look for this brand when it is time for the next TV mount.,0,212,0972683275,Electronics
ELECTRONICS_000076,ELECTRONICS_000076-0,I have two of these now in different rooms. Works well with my Samsung TV'S  for the size noted above,0,101,0972683275,Electronics
ELECTRONICS_000077,ELECTRONICS_000077-0,"We got this one recently and its a great wall mount. The unit is pretty heavy, so you will need a helper. It also includes a variety of screws to mount also. Our TV documentation stated it was a 400x400 pattern. But after putting hte plate over the back, seems we didn't need the extra extenders as its 200x200. This is on a Samsung 40&#34; 5000 series LEDTV.The arm is hard to push and pull, but that is more due to being new and stiff. Make sure you adjust the tilt angle screws as our unit came with them loose so we had to tighten them.I initially was scared to mount it (what if it falls if I screw up!!!) but its pretty easy. Not only did i use a stud finder to get the general location of the ",0,700,0972683275,Electronics
ELECTRONICS_000077,ELECTRONICS_000077-1,"stud, but i also used nails to get the actual edges (those basic studfinders are never &#34;exact&#34;). make sure you do the same.not bad for $30-ish",700,850,0972683275,Electronics
ELECTRONICS_000078,ELECTRONICS_000078-0,this is a good product.  It went up easily.  I did it myself.  I wish I might have gotten one with a little more adjustment.  It's very rigid.,0,142,0972683275,Electronics
ELECTRONICS_000079,ELECTRONICS_000079-0,I have purchased 3 of these wall mounts and they hold my 37 and 32 inch flat screens perfectly. I love these and highly recommend them.,0,135,0972683275,Electronics
ELECTRONICS_000080,ELECTRONICS_000080-0,"Very good item; I am happy wit it, and delivery time was excellent!!  I recomended; is a good support for your LED TV. It is easy to install, and it have extra screws for different sizes TV.",0,190,0972683275,Electronics
ELECTRONICS_000081,ELECTRONICS_000081-0,"This was perfect for my 24"" LED monitor, I had it up in just a few mins and with no problems.  It included a small bubble level and it also came with a 6' HDMI cable which I was not expecting.",0,192,0972683275,Electronics
ELECTRONICS_000082,ELECTRONICS_000082-0,"I checked around Amazon as well as some other sites, and decided these were what I needed.  I read the reviews, looked at the pictures and bought two of these.  I received them today.  I unpacked one of them, read the instructions and immediately filled out the return request for Amazon.  These mounts are very, very heavy and require 6, yes SIX, screws to mount to the wall.  Are you kidding me?  The TVs are only 22 lbs!  Two screws in the studs and then more damage to the wall than is necessary.  What a joke!  And Lag bolts?  Ever heard of screws?  The other issue is that these are very hard to move.  I bought an articulating wall mount for a reason, and I expect them to be able to move with",0,700,0972683275,Electronics
ELECTRONICS_000082,ELECTRONICS_000082-1,out a wrench in my hand.,700,724,0972683275,Electronics
ELECTRONICS_000083,ELECTRONICS_000083-0,"Installed easily, has a nice long reach.  Attached a 32&#34; TV for the grandkids and it works out great. accomodates many different size TV's and was a very good price.",0,169,0972683275,Electronics
ELECTRONICS_000084,ELECTRONICS_000084-0,"For the price.....can't be beat.  I have two TV's hanging in the living room.  No issues, easy to hang.  I would recommend to a friend.",0,135,0972683275,Electronics
ELECTRONICS_000085,ELECTRONICS_000085-0,Works Great. Holds my 40 inch TV effortlessly. Very well built. Definitely worth the price. Easy to install TV to the mount. Has cord clips. TV can be tilted up or down and sideways. Extends from the wall 24 inches. I highly recommend this brand..,0,247,0972683275,Electronics
ELECTRONICS_000086,ELECTRONICS_000086-0,"Used this with a Panasonic 22 inch LCD. Very durable and works as advertised.It was advertised as fitting 22""-37"" televisions, but the size of the t.v mounting plate is so large that it covers some of the plug connections on the back of the television. I will have to cut the metal plate to get to the P.C connector if i choose to connect a computer.Haven't decided if i will keep or send back to get something with a smaller mounting plate.Other than that, it's a great product and meets my need for a hanging television.",0,522,0972683275,Electronics
ELECTRONICS_000087,ELECTRONICS_000087-0,"I have a 47&#34; TV and had no place to put it in my bed room. With this mount it use the space i had a poster hanging. Very easy to install, came with all hard ware.",0,166,0972683275,Electronics
ELECTRONICS_000088,ELECTRONICS_000088-0,"Great Mount, so many areas of articulation. This was a great gift idea my mother loves it. I have purchased two of them and they are sturdy and give a touch of class to every room you put them in. A must have any video file or those who want to save space in a bedroom or office.",0,279,0972683275,Electronics
ELECTRONICS_000089,ELECTRONICS_000089-0,This is perfect for what I needed it for. I can move the screen from side to side if I need to and I don't have the TV sitting on my desk.....,0,142,0972683275,Electronics
ELECTRONICS_000090,ELECTRONICS_000090-0,have not had the opportunity to install the tv mount as of yet - will follow up once mounted in place. great price and quick shipping,0,133,0972683275,Electronics
ELECTRONICS_000091,ELECTRONICS_000091-0,Why pay the $$$$ at Best Buy when you can get the same products for a fraction of the prices here.  The VideoSecu Long Arm TV Wall Mount Low Profile Full Motion works great.,0,173,0972683275,Electronics
ELECTRONICS_000092,ELECTRONICS_000092-0,"Pro's: Easy to setup.  Supports many different VESA formats. Has some articulation.  Sturdy construction.  Can be installed by one person w/o too much effort.Con's: Cable guides fall off easily.  The joints are a bit too stiff; you really have to man-handle it to get it fully extended, and you have to push fairly hard to get it to compact again.  So far I have not noticed any wear from this firm pulling/pushing, but I worry because it is only attached to the studs buy 2 bolts.",0,481,0972683275,Electronics
ELECTRONICS_000093,ELECTRONICS_000093-0,We bought this for a 55&#34; Vizio and it worked perfectly. I would buy it again and recommend it. Good quality.,0,112,0972683275,Electronics
