review_id,chunk_id,chunk_text,span_start,span_end,asin,category
ELECTRONICS_000150,ELECTRONICS_000150-0,"Good, strong mount and quality hardware. Includes all the different size screws required to attach to TV if yours doesn't have them (or if you lost them).  There is just the right amount of resistance in the joints for it to stay where you want it but still easy to move around.  I mounted a shelf above the TV to get the cable box out of the way and avoid having to run a long HDMI cable through the wall.I took a star only because I received a different unit than the one pictured, It has 2 thick arms, rather than the 2-1 that is shown.  Honestly I think what I got is more attractive, but I believe that Amazon vendors should not substitute different products without authorization.  My unit also",0,700,0972683275,Electronics
ELECTRONICS_000150,ELECTRONICS_000150-1," did not come with the extender arms in the picture, it has a mounting plate with all of the VESA mounting holes in the correct configuration.  My TV is 26&#34; so it fit perfectly.  I am sure my 55&#34; would fit on it too, but I have a different mounting configuration for that one.",700,984,0972683275,Electronics
ELECTRONICS_000151,ELECTRONICS_000151-0,"Very solid...we mounted our flat panel in the bedroom. Like the tipping feature and love the articulating feature.We checked prices at stores, big boxes, etc. best price of all including Costco...",0,196,0972683275,Electronics
ELECTRONICS_000152,ELECTRONICS_000152-0,I bought this tv swing arm mount for my tv from amazon.Its been a good one its built heavy duty to hold pretty big tv .I would have anyone of my friends buy this same mount for their tv. It lets you hang it up and out of the way and also you can turn it out or in adjustable to see it from anywhere I set in my living room. This unit is easy to mount on wall and put together by yourself but if you have an extra person around it would make it a little better when holding the tv up when it clips in at top then screw and tighten and adjustments and like everything else I've bought from amazon it ships fast right to your door step.,0,633,0972683275,Electronics
ELECTRONICS_000153,ELECTRONICS_000153-0,Easy to attach. Easy to adjust. Very Solid and secure. Used on a clients 29&#34; LED with built in DVD.,0,103,0972683275,Electronics
ELECTRONICS_000154,ELECTRONICS_000154-0,I have my 32 inch Tv on the wall and it works great. Easy to install and came with all the parts. The screws that it comes with for the TV will not fit but you can buy some for 2 dollars.,0,187,0972683275,Electronics
ELECTRONICS_000155,ELECTRONICS_000155-0,"For the money you can't go wrong. Yes, it has a litlle play in the mechanism but, you can adjust your mounting to accomodate that. It works great and frees up counter space. I would do it all again. Why spend 3 times more.",0,222,0972683275,Electronics
ELECTRONICS_000156,ELECTRONICS_000156-0,I love this mount! All the adjustments for tilt and extension are awesome! Holds a Sony 32in Ex-3000 just fine even fully extended. Even bought another. A++Mike,0,160,0972683275,Electronics
ELECTRONICS_000157,ELECTRONICS_000157-0,"I have this mounted on my wall in my editing studio.  It holds a 27"" LCD monitor (about 20-25lbs).  It's been up for a week and I don't expect that it will fall down anytime soon.",0,179,0972683275,Electronics
ELECTRONICS_000158,ELECTRONICS_000158-0,"My students and I used to huddle around laptops to discuss projects. Now I have a 47&#34; TV for display and this mount makes it possible to put it on any wall and swivel it in any direction depending on how many people need to see the screen. Really stable, no wiggling",0,270,0972683275,Electronics
ELECTRONICS_000159,ELECTRONICS_000159-0,"It is a good value, but is not top notch quality. If you extend both arms in the same direction, the TV (30 inch) tilts. However if the arm goes right, then left, the play in the hinges offset each other and it works great.",0,223,0972683275,Electronics
ELECTRONICS_000160,ELECTRONICS_000160-0,"The mount itself seems fine, it just didn't work with the Phillips tv we bought....the 'x' arm things did not line up and if they did then the 'x' parts would have covered the holes for the inputs...........we ended up using one we had had around here.......seems to be built well though and sturdy",0,298,0972683275,Electronics
ELECTRONICS_000161,ELECTRONICS_000161-0,"Got this to replace a Peerless Paramount wall mount when I got my new TV.  Let me start off by saying it works as advertised.  But that won't get you 5 stars.  The problem is installation.  Maybe it's my own fault for thinking all TV wall mounts worked like the Peerless I had.  See, that one has a separate TV plate that you screw to the TV first.  Then you have the second piece (the actual wall mount) that you screw to the wall.  Once that's done, using the bracket mounted on the TV, you hang the TV on the wall mount and secure it with a single bolt.  One person can easily put a TV on the wall.Not so much with this one.  Yes, I will admit that once it's mounted, it's a more secure connection",0,700,0972683275,Electronics
ELECTRONICS_000161,ELECTRONICS_000161-1,", but it's the mounting that's the problem.  You can't do it alone.  Depending on the weight of the TV, you will need at least one helper.  This mount is one piece, which means that you have to hold the TV to the wall-mounted plate while attaching it with screws.  That can get tricky, especially with heavier TVs (I used it for a while with my old LCD TV which weighs 40+ pounds).  They do get kudos for providing all the screws for all VESA types as well as a regular and an Allen wrench.Three stars for ease of installation, five stars for usability, for a combined four stars.  Make sure you get help when installing.",700,1321,0972683275,Electronics
ELECTRONICS_000162,ELECTRONICS_000162-0,"It is up know and should work fine, but it was hard to get it to fit my TV due to the bulge on the bottom, but I made it work and it is on the wall.",0,148,0972683275,Electronics
ELECTRONICS_000163,ELECTRONICS_000163-0,"Very strong for any tv, but I wish that it was little longer I am very happy with it and very strongly recommended.",0,115,0972683275,Electronics
ELECTRONICS_000164,ELECTRONICS_000164-0,"Easy install!! Looks great and works great for what we need!! Purchased for game room, took 5 min. to install and 1 min. to set TV on. Great!!",0,142,0972683275,Electronics
ELECTRONICS_000165,ELECTRONICS_000165-0,"It is a solid mount and I doubt that it will ever fail to hold the 22"" LED TV that is mounted on it.  My only complaint is that the bolt that attaches the arm to the wall plate is smaller then the hole in the wall plate so when the TV is anything other than parallel to the wall it leans (up to 1.25"" from one side of the TV to the other ~16"") but for the price I can live with that.",0,383,0972683275,Electronics
ELECTRONICS_000166,ELECTRONICS_000166-0,"The mount works, but it is unrefined compared to other brands out there. Purchased because it was on sale. just ok.",0,115,0972683275,Electronics
ELECTRONICS_000167,ELECTRONICS_000167-0,"I consider myself to be a good DIYer. I've installed mounts for my 2 Samsung 46"" and 55"" LED TVs with no problems for 5 years. So, for this VideSecu mount, inspite of poor installation instructions, I carfeully measured all domensions to fit my new 32"" Samsung LED SmartTV in a limited kitchen space. My mistake was, based on the diagrams, I assumed that the length of both the swinging arms of the mount (the single and the double arms) were of the same length. What a disaster! After installing the mount when I mounted the TV and folded the arms the TV did not center itself to the wall side of the mount! It was then that I noticed the inner length of the 2 arms is about 4"" longer than the outer",0,700,0972683275,Electronics
ELECTRONICS_000167,ELECTRONICS_000167-1, single arm. In other words once the arms on the mount were fully folded in towards the wall my TV was not centered in the limited space that I had and looked awful. I don't know why the manufacturer did not keep both arms the same length. At least they shd have mentioned it in the instructions.This to me is a major product defect. Luckily with Amazon I was able to return this mount but had to pay return S&H;.,700,1113,0972683275,Electronics
ELECTRONICS_000168,ELECTRONICS_000168-0,Works great for a cheap mount. Worked great on a 32&#34; Emerson LCD tv. Does everything as advertised! Can tighten or loosen joints for easier movement.,0,153,0972683275,Electronics
ELECTRONICS_000169,ELECTRONICS_000169-0,We needed something to Extend our tv away from the hot pipe for the winter and this wall mount did the trick. It went up with no a problems. It worked out very well!,0,165,0972683275,Electronics
ELECTRONICS_000170,ELECTRONICS_000170-0,"its a little flimsy and not the easiest to put together, for the price it works.  But for the quality i'd go with Cheetah.",0,122,0972683275,Electronics
ELECTRONICS_000171,ELECTRONICS_000171-0,We needed a wall mount for a 32&#8221; TV that was going to be in the screened in porch.  This was one of the brands recommended by the guy that was going to install out wall mount.  I can&#8217;t speak to the ease or difficulty of installation but it looks great and we can swivel it if necessary for best viewing angle.  It's also pretty sleek so it doesn't butt out too much.  It arrived quickly and it didn&#8217;t take the installer long but of course he was a professional.  Looks great!,0,493,0972683275,Electronics
ELECTRONICS_000172,ELECTRONICS_000172-0,It works for the tv I bought but I had to use some of my own washers for the screws.  I thought it would have everything.,0,121,0972683275,Electronics
ELECTRONICS_000173,ELECTRONICS_000173-0,"I have mounted a 42 inch old LCD. Easy to install. Easy to swivel, there is tilt option but it has to be locked by nuts(it can not be changed without loosing the nuts).",0,168,0972683275,Electronics
ELECTRONICS_000174,ELECTRONICS_000174-0,I wanted to put my mac in the wall and leave it. This does that well.  I don't move it often it seems strong and well built. If you want to move it a lot get something different you have to keep an Allen wrench and a crescent wrench in the desk drawer if you plan on moving it a lot. The articulation is sketchy. For my uses and the cheap price this was perfect.,0,362,0972683275,Electronics
ELECTRONICS_000175,ELECTRONICS_000175-0,"I have purchased a total of 4 HDTV wall mounts from the VideoSecu companyand they are all quality products at a very reasonable price.-Tilt TV Mount: for stationary TVs up to 65 inches.-Articulating:  corner mount for SMALL TVs-Long Arm:  corner or high mobility mount for LARGER TVsAll of them are excellent products, and very easy to install.",0,344,0972683275,Electronics
ELECTRONICS_000176,ELECTRONICS_000176-0,"Received this item quickly and well packaged (But not so well that I was infuriated trying to open it)Everything was in perfct order. Strong, handsome appearance. Installation Kit is perfectly in order and gives a ton of options for different senarios.  Couldn't possibly be happier with this product.",0,301,0972683275,Electronics
ELECTRONICS_000177,ELECTRONICS_000177-0,"Could offer a little more in flexibility of installation, but once in place the set can be placed in just the right position repeatedly.",0,136,0972683275,Electronics
ELECTRONICS_000178,ELECTRONICS_000178-0,The directions stink. Just remember the spacers go under the arms if you have to use them and you will be ok.,0,109,0972683275,Electronics
ELECTRONICS_000179,ELECTRONICS_000179-0,It is better than spending twice the money on this going into a brick and mortar store. Was very pleased.,0,105,0972683275,Electronics
ELECTRONICS_000180,ELECTRONICS_000180-0,"Good quality.  Must mount on a stud.  I mounted to a metal stud by cutting a rectangle hole in wall, adding a 2 ft 2x4 in the metal stud track, patched the hole and then put up the mount.  Holds a 37&#34; TV without a problem,even added a DVD player to the bottom of the TV and it is still on the wall after about 8 months.  Price on this item was great and it was sent with FREE FREIGHT!",0,388,0972683275,Electronics
ELECTRONICS_000181,ELECTRONICS_000181-0,"This item didn't disappoint. It's sturdy, has all the screws included for different flat screen models and yes, it works well.",0,126,0972683275,Electronics
ELECTRONICS_000182,ELECTRONICS_000182-0,This worked perfect.  The universal design would fit 99.9% of the TV's as advertised.  Easy to mount and very durable.,0,118,0972683275,Electronics
ELECTRONICS_000183,ELECTRONICS_000183-0,"I have a full 42&#34; HD flat screen mounted on this. Not only does everything look better than strapped to a table, but the adjustability makes this mount a pleasure to have.  It was simple to attach to the wall and has a small footprint, being a single stud wall mount.  The other major point of this mount is how many sized TV or monitors the mount can be adjusted to accept.  My TV mounts solidly and the mount itself is solid, yet adjusts with little effort.  This is just plainly a good and solid product that is well worth the money.",0,540,0972683275,Electronics
ELECTRONICS_000184,ELECTRONICS_000184-0,"had a couple of guys put this up for me, but they said it was easy to install. I like the fact that I can move it around easily and tilt it anyway I want it to be.",0,163,0972683275,Electronics
ELECTRONICS_000185,ELECTRONICS_000185-0,This product is user friendly and versatile.It is easy to install and comes with everything needed for installation.Adding bidding could drill and bit,0,150,0972683275,Electronics
ELECTRONICS_000186,ELECTRONICS_000186-0,it was so easy to install.  the instructions were simple and so was the process.  i was putting off the project for fear.  i should have hung the TV long ago.,0,158,0972683275,Electronics
ELECTRONICS_000187,ELECTRONICS_000187-0,works great was pretty easy to put up and does the trick. it is my sons room and really works great.,0,100,0972683275,Electronics
ELECTRONICS_000188,ELECTRONICS_000188-0,"I am very happy with this affordable wall mount for my Sony 32"" Internet TV. One nice feature ist that you can swivel the mounted TV depending on where you are seated.",0,167,0972683275,Electronics
ELECTRONICS_000189,ELECTRONICS_000189-0,"I have a 26"" LCD monitor mounted on unit.Seems sturdy enough, would prefer a more fluid motion and a way to adjust the pivot of the screen without tools.  As it is I keep it loose and it is reasonbly adjustable.For the price I certanily can't complain and would recommend this unit.",0,282,0972683275,Electronics
ELECTRONICS_000190,ELECTRONICS_000190-0,"Easy to install, and works great. Television moves with ease and always feels secure. Doesn't loosen over time like other television mounts.",0,140,0972683275,Electronics
ELECTRONICS_000191,ELECTRONICS_000191-0,This was for a 32 inch LCD.  Easy to install and works great.  I am very satisfied with this wall mount.,0,104,0972683275,Electronics
ELECTRONICS_000192,ELECTRONICS_000192-0,"Fits many different size TV's,  is very solid, and was easy to install.  I would recommend to anyone is even slightly handy.",0,124,0972683275,Electronics
ELECTRONICS_000193,ELECTRONICS_000193-0,"I'm using this with my 32"" tv and I love it. The price is significantly lower than what you can find for monitor wall mounts in the retail stores (walmart, best buy).I found this to be an easy install and very secure. The swivel is smooth and I can orient my television perfectly. It also has plenty of VESA mount patterns so it will hold just about any TV.",0,357,0972683275,Electronics
ELECTRONICS_000194,ELECTRONICS_000194-0,"For such a cheap mount, it works well. I installed in in about 20 minuets and use it to hole a 32"" Vizio LED.",0,109,0972683275,Electronics
ELECTRONICS_000195,ELECTRONICS_000195-0,"This was a present for myself, my son installed it, in about 25 minutes, and I couldn't be happier.  I wasn't sure this was for me as it for my bedroom, but my husband and I love it.  So easy to move the TV no matter where you are in the room.  A great buy.",0,257,0972683275,Electronics
ELECTRONICS_000196,ELECTRONICS_000196-0,Mounting the TV after mounting on wall can be a handful.  It would have been nice to have some type of slide in mount for the TV so you did not have to hold it while putting in 4 screws.  That would make DIY one person installation easier.,0,239,0972683275,Electronics
ELECTRONICS_000197,ELECTRONICS_000197-0,"When we first bought our bedroom tv, we looked at the mounts in the store and almost fell over from shock at the prices.  This is one of the best prices I have found on mounts.  This mount went up easy and moves in all directions to get the perfect viewing angle.  it comes with everything you need but the drill and tv!  You won't be disappointed with this brand.",0,364,0972683275,Electronics
ELECTRONICS_000198,ELECTRONICS_000198-0,"If I need to order another, this will be the one.  I used this to mount a TV to the wall in my basement and it allows me to pull the tv out from the wall and turn it towards my desk so I can watch TV while working on the PC, nearly a 90 degree angle.  My TV is only a 32&#34; and I could see that this would work up to a 40&#34; or so, but if you don't need to turn the TV 90 degrees, you could get by with a larger TV.",0,419,0972683275,Electronics
ELECTRONICS_000199,ELECTRONICS_000199-0,"I was hesitant about mounting my larger flat screen (47&#34; LG) onto the wall - what happens if it falls off!  After looking at mounts at Target and Best Buy that were $100+, would this possibly work?Fast forward...  The mount took about 20 minutes to install (too longer to locate the studs than mount it).  The TV is on the wall and works wonderfully.  Very solid mount and good articulation.My only comments are the cord clips included are very weak.  I will be replacing them with black cable ties.  Also - they do need to have a second locking screw where you hang the TV on the articulating mount - I can wiggle my screen (tilt) by about 1/4&#34; since there is only a screw on the bottom.Over",0,700,0972683275,Electronics
ELECTRONICS_000199,ELECTRONICS_000199-1,"all, I liked the narrow wall mount and the 20&#34; extension.  Definitely would recommend for a TV that is 47&#34;.",700,815,0972683275,Electronics
